{
  "$schema": "../../reports/schemas/return-report.schema.json",
  "reportType": "ReturnReport",
  "reportVersion": "0.1.0",
  "returnReportId": "rrr-163cdd5d84a09b71",
  "generatedAt": "2026-03-30T04:34:33Z",
  "overallStatus": "PASS",
  "demo": {
    "demoId": "return-quickstart",
    "demoVersion": "0.1.0",
    "runtimeMode": "QUICKSTART",
    "command": "make demo-return-quickstart",
    "manifestPath": "examples/demo-scenarios/return/quickstart-demo-config.json",
    "outputDirectory": "reports/generated",
    "primaryOptimizationArtifact": "reports/generated/positive-return-quickstart-optimization-report.json",
    "scenarioCount": 4,
    "positiveScenarioCount": 1,
    "negativeScenarioCount": 3
  },
  "artifacts": {
    "returnReportPath": "reports/generated/return-quickstart-report.json",
    "markdownSummaryPath": "reports/generated/return-quickstart-summary.md",
    "timelinePath": "reports/generated/return-quickstart-timeline.md"
  },
  "scenarios": [
    {
      "scenarioId": "positive-return-quickstart",
      "mode": "POSITIVE",
      "description": "The Control Plane evaluates the currently encumbered set, retains the minimum pledged coverage, prepares the Quickstart return workflow, executes the reference-token release path, and proves the final post-return state.",
      "result": "SUCCESS",
      "summary": "Quickstart prepared return request quickstart-return-request-831, the adapter released quickstart-ret-current-ust-831, and Canton closed the return with replay handling NOT_REQUESTED.",
      "observedReasonCodes": [],
      "expectedReasonCodes": [],
      "policyEvaluationReportPath": "reports/generated/positive-return-quickstart-policy-evaluation-report.json",
      "optimizationReportPath": "reports/generated/positive-return-quickstart-optimization-report.json",
      "workflowInputPath": "reports/generated/positive-return-quickstart-workflow-input.json",
      "workflowResultPath": "reports/generated/positive-return-quickstart-workflow-result.json",
      "quickstartSeedReceiptPath": "reports/generated/positive-return-quickstart/localnet-control-plane-seed-receipt.json",
      "adapterExecutionReportPath": "reports/generated/positive-return-quickstart/localnet-return-adapter-execution-report.json",
      "adapterStatusPath": "reports/generated/positive-return-quickstart/localnet-return-status.json",
      "workflowRuntime": "QUICKSTART",
      "policyDecision": "ACCEPT",
      "optimizationStatus": "OPTIMAL",
      "currentPostedLotIds": [
        "quickstart-ret-current-fannie-831",
        "quickstart-ret-current-kfw-831",
        "quickstart-ret-current-ust-831"
      ],
      "retainedLotIds": [
        "quickstart-ret-current-fannie-831",
        "quickstart-ret-current-kfw-831"
      ],
      "returnLotIds": [
        "quickstart-ret-current-ust-831"
      ],
      "requestedReturnQuantity": 180000.0,
      "remainingRequiredCoverage": 250000.0,
      "blockedPhase": null,
      "adapterOutcome": "EXECUTED",
      "requestIdentifier": "quickstart-return-request-831",
      "approvalState": {
        "securedPartyApproval": "ApprovalGranted",
        "custodianApproval": "ApprovalGranted",
        "workflowGate": "PREPARE_FOR_ADAPTER",
        "releaseConditionSatisfied": true
      },
      "releaseAction": {
        "settlementInstructionId": "quickstart-return-correlation-831-instruction",
        "settlementInstructionState": "Settled",
        "settlementAction": "ReturnCollateral",
        "adapterReceiptStatus": "EXECUTED",
        "adapterMovementLotIds": [
          "quickstart-ret-current-ust-831"
        ]
      },
      "finalPostReturnState": {
        "returnState": "Closed",
        "settlementInstructionState": "Settled",
        "returnedLotIds": [
          "quickstart-ret-current-ust-831"
        ],
        "remainingEncumberedLotIds": [
          "quickstart-ret-current-fannie-831",
          "quickstart-ret-current-kfw-831"
        ],
        "returnedHoldingLotIds": [
          "quickstart-ret-current-ust-831"
        ],
        "remainingHoldingLotIds": [
          "quickstart-ret-current-fannie-831",
          "quickstart-ret-current-kfw-831"
        ],
        "providerVisibleAdapterReceiptCount": 1
      },
      "replayHandlingResult": {
        "attempted": false,
        "result": "NOT_REQUESTED",
        "controlCheckId": null,
        "detail": "no replay attempt was requested for this Quickstart return path"
      },
      "workflow": {
        "executionReports": [],
        "executionReportCount": 0,
        "workflowGate": "PREPARE_FOR_ADAPTER",
        "settlementInstructionId": "quickstart-return-correlation-831-instruction",
        "settlementInstructionState": "PendingSettlement",
        "custodianApproval": "ApprovalGranted",
        "currentSecuredAmount": 450000.0,
        "obligationId": "quickstart-return-obligation-831",
        "atomicityOutcome": "PENDING_ATOMIC_SETTLEMENT",
        "controlChecks": [
          {
            "checkId": "APPROVAL_GATE_BLOCKED",
            "status": "PASS",
            "detail": "provider could not create a return settlement intent until the required approvals were recorded on Quickstart"
          }
        ],
        "returnedLotIds": [],
        "currentEncumberedLotIds": [
          "quickstart-ret-current-ust-831",
          "quickstart-ret-current-fannie-831",
          "quickstart-ret-current-kfw-831"
        ],
        "releaseConditionSatisfied": true,
        "returnRequestId": "quickstart-return-request-831",
        "scenarioId": "positive-return-quickstart",
        "requestedReturnQuantity": 180000.0,
        "remainingRequiredCoverage": 250000.0,
        "remainingEncumberedLotIds": [
          "quickstart-ret-current-ust-831",
          "quickstart-ret-current-fannie-831",
          "quickstart-ret-current-kfw-831"
        ],
        "returnState": "PendingSettlement",
        "steps": [
          {
            "actor": "provider",
            "step": 1,
            "state": "Encumbered",
            "phase": "BASELINE",
            "detail": "provider started from an already pledged collateral set on Quickstart"
          },
          {
            "actor": "provider",
            "step": 2,
            "state": "Draft",
            "phase": "RETURN",
            "detail": "provider created the draft return request on Quickstart"
          },
          {
            "actor": "provider",
            "step": 3,
            "state": "Submitted",
            "phase": "RETURN",
            "detail": "provider submitted the return request on Quickstart"
          },
          {
            "actor": "provider",
            "step": 4,
            "state": "UnderEvaluation",
            "phase": "RETURN",
            "detail": "provider moved the return request into evaluation on Quickstart"
          },
          {
            "actor": "provider",
            "step": 5,
            "state": "PendingApproval",
            "phase": "RETURN",
            "detail": "provider recorded a feasible return after checking the retained-set coverage condition on Quickstart"
          },
          {
            "actor": "provider",
            "step": 6,
            "state": "Blocked",
            "phase": "CONTROL",
            "detail": "provider could not create the return settlement intent before the required approvals were recorded"
          },
          {
            "actor": "secured-party",
            "step": 7,
            "state": "PendingApproval",
            "phase": "RETURN",
            "detail": "secured party approved the return request on Quickstart"
          },
          {
            "actor": "custodian",
            "step": 8,
            "state": "Approved",
            "phase": "RETURN",
            "detail": "custodian approved the return request on Quickstart"
          },
          {
            "actor": "provider",
            "step": 9,
            "state": "PendingSettlement",
            "phase": "SETTLEMENT",
            "detail": "provider submitted the approved return settlement intent and exposed the release instruction to the adapter"
          }
        ],
        "correlationId": "quickstart-return-correlation-831",
        "securedPartyApproval": "ApprovalGranted"
      }
    },
    {
      "scenarioId": "negative-unauthorized-return-quickstart",
      "mode": "NEGATIVE",
      "description": "Quickstart reaches pending settlement for the approved return, but the provider cannot confirm release and the adapter path remains untouched.",
      "result": "EXPECTED_FAILURE",
      "summary": "Quickstart blocked the return at workflow state PendingSettlement with control checks APPROVAL_GATE_BLOCKED, UNAUTHORIZED_RETURN_BLOCKED and provider-visible adapter receipts 0.",
      "observedReasonCodes": [
        "APPROVAL_GATE_BLOCKED",
        "UNAUTHORIZED_RETURN_BLOCKED"
      ],
      "expectedReasonCodes": [
        "APPROVAL_GATE_BLOCKED",
        "UNAUTHORIZED_RETURN_BLOCKED"
      ],
      "policyEvaluationReportPath": "reports/generated/negative-unauthorized-return-quickstart-policy-evaluation-report.json",
      "optimizationReportPath": "reports/generated/negative-unauthorized-return-quickstart-optimization-report.json",
      "workflowInputPath": "reports/generated/negative-unauthorized-return-quickstart-workflow-input.json",
      "workflowResultPath": "reports/generated/negative-unauthorized-return-quickstart-workflow-result.json",
      "quickstartSeedReceiptPath": "reports/generated/negative-unauthorized-return-quickstart/localnet-control-plane-seed-receipt.json",
      "adapterExecutionReportPath": null,
      "adapterStatusPath": "reports/generated/negative-unauthorized-return-quickstart/localnet-return-status.json",
      "workflowRuntime": "QUICKSTART",
      "policyDecision": "ACCEPT",
      "optimizationStatus": "OPTIMAL",
      "currentPostedLotIds": [
        "quickstart-ret-current-fannie-841",
        "quickstart-ret-current-kfw-841",